election_date,election_year,election_month,election_day,prop_letter_or_num,prop_title,num_yes_votes,num_no_votes,pct_yes_votes,pct_no_votes,pct_required_to_pass,pass_or_fail,raw_source_of_prop,source_of_prop,prop_kind,description,prop_url
11/5/1907,1907,11,5,1,Bonds issued for acquisition of public utilities,23257,4637,83.3,16.7,50%+1,P,Supervisors,supervisors,Charter Amendment,"Setting forth a proposal relating to bonds issued for the acquisition of public utilities, the registration thereof, and the levy of taxes to provide for the interest thereon and a sinking fund, and to bonds issued for the acquisition of land and the construction or acquisition of any permanent building or buildings, improvement or improvements.",https://sfpl.org/index.php?pg=2000027201&propid=1
11/5/1907,1907,11,5,2,Recall of Elected Officials,22945,5579,80.4,19.6,50%+1,P,Supervisors,supervisors,Charter Amendment,The holder of any elective office may be removed at any time by the electors qualified to vote for a successor of each incumbent. A petition must be filed with the Board of Election Commissioners with signatures equal to 30% (percent) of registered voters and must contain a general statement of the grounds for which the removal is sought.,https://sfpl.org/index.php?pg=2000027201&propid=2
11/5/1907,1907,11,5,3,Apportionment of Fund Revenue; Interest on Bonded Indebtedness; Sinking Funds,21000,5809,78.3,21.7,50%+1,P,Supervisors,supervisors,Charter Amendment,Relating to the apportionment of the income and revenue of funds and a provision for income to pay interest on the bonded indebtedness and provide for the sinking funds. The sinking funds shall always be provided for out of the tax on property.,https://sfpl.org/index.php?pg=2000027201&propid=3
11/5/1907,1907,11,5,4,Responsibility of treasurer for public funds,22425,5285,80.9,19.1,50%+1,P,Supervisors,supervisors,Charter Amendment,Relating to the custody by the Treasurer of public funds and authorizing their deposit in certain banks upon certain terms and conditions.  Treasurer shall receive and safely keep all moneys which shall be paid into the Treasury.,https://sfpl.org/index.php?pg=2000027201&propid=4
11/5/1907,1907,11,5,5,"Board of Public Works; Contracts, Bonds and Payments",20527,7039,74.4,25.6,50%+1,P,Supervisors,supervisors,Charter Amendment,"Relating to contracts entered into by the Board of Public Works, and bonds to be given in connection with the same, permitting progressive payments to be provided upon certain terms and conditions. All contracts shall be drawn under the supervision of the City Attorney.",https://sfpl.org/index.php?pg=2000027201&propid=5
11/5/1907,1907,11,5,6,Officers of City to be Bonded,21970,4495,83.0,17.0,50%+1,P,Supervisors,supervisors,Charter Amendment,Officers shall respectively execute official bonds to the City and County.,https://sfpl.org/index.php?pg=2000027201&propid=6
11/5/1907,1907,11,5,7,Board of Supervisors' Appropriation for Urgent Necessities,20961,5358,79.6,20.4,50%+1,P,Supervisors,supervisors,Charter amendment,"Relating to the appropriation of $100,000 a year by the supervisors for urgent necessities not otherwise provided for by law.",https://sfpl.org/index.php?pg=2000027201&propid=7
11/5/1907,1907,11,5,8,Composition of Members of Fire Department; Salaries and Vacations,35017,8347,80.7,19.3,50%+1,P,Supervisors,supervisors,Charter Amendment,Relative to the composition of the personnel of the companies of the Fire Department and the salaries and vacations of the members.,https://sfpl.org/index.php?pg=2000027201&propid=8
11/5/1907,1907,11,5,9,Taxes or Bonded Indebtedness; Acquisition of Public Utilities,20861,5858,78.0,22.0,50%+1,P,Supervisors,supervisors,Charter Amendment,"The City shall have the power to acquire, construct or complete any public utility from funds derived from taxes levied for that purpose, or from funds derived from the sale of bonds issued for that purpose and may operate, maintain, sell or lease any public utility subject to the provisions of this Charter.",https://sfpl.org/index.php?pg=2000027201&propid=9
11/5/1907,1907,11,5,10,Sale of City-Owned Lands; Future Land Acquisitions,15023,10573,58.6,41.4,50%+1,P,Supervisors,supervisors,Charter Amendment,"City and County of San Francisco to have power to sell all lands owned by the City and County between Ninth street and Eighteenth street, formerly Mission Creek, and any and all future acquisitions, excepting lands for parks, squares and children's playgrounds.",https://sfpl.org/index.php?pg=2000027201&propid=10
11/5/1907,1907,11,5,11,Changes to Street Grades,18499,7774,70.4,29.6,50%+1,P,Supervisors,supervisors,Charter Amendment,Relating to the changes or modifications of street grades and the performance of street work in connection therewith.,https://sfpl.org/index.php?pg=2000027201&propid=11
11/5/1907,1907,11,5,12,"Opening, Closing, Widening, Straightening, and Extending of Streets",18501,8109,69.5,30.5,50%+1,P,Supervisors,supervisors,Charter Amendment,"Relating to the opening, extending, widening, straightening or closing up of streets and the performance of street work in connection therewith, and the condemnation and acquisition of land and property necessary therefor.",https://sfpl.org/index.php?pg=2000027201&propid=12
11/5/1907,1907,11,5,13,Liability for Damages against the City and its Officials,19817,6605,75.0,25.0,50%+1,P,Supervisors,supervisors,Charter Amendment,"No recourse shall be had against the City for damage or loss to person or property due to the defective condition, or lack of repair, of any sidewalk, street, avenue, lane, alley, court, place or sewer.",https://sfpl.org/index.php?pg=2000027201&propid=13
11/5/1907,1907,11,5,14,Leasing of Real Property of School Department,20451,5707,78.1,21.9,50%+1,P,Supervisors,supervisors,Charter Amendment,"To lease to the highest responsible bidder, for the benefit of the Common School Fund and for a term not exceeding thirty-five years, any real property of the School Department not required for school purposes.",https://sfpl.org/index.php?pg=2000027201&propid=14
11/5/1907,1907,11,5,15,Board of Supervisors; Power to grant permits for spur tracks,20501,11504,64.0,36.0,50%+1,P,Supervisors,supervisors,Charter Amendment,"To permit spur tracks for industrial purposes only, for purpose of connecting warehouses, manufactories, or other business industries and enterprises with the Belt Line of railroads along the water front or other lines of railroad.",https://sfpl.org/index.php?pg=2000027201&propid=15
11/5/1907,1907,11,5,16,Contract for Official Advertising; Official Newspaper,12012,16729,41.7,58.3,50%+1,F,Supervisors,supervisors,Charter Amendment,"All contracts for official advertising to be let annually to the lowest responsible bidder publishing a daily newspaper with a daily circulation of at least two thousand copies and that has been in in existence for at least two years.  Advertising to be construed to mean the advertising and publication of all official reports, orders, ordinances relating to City work. The newspaper awarded such a contract shall be known as the ""Official Newspaper"".",https://sfpl.org/index.php?pg=2000027201&propid=16
11/5/1907,1907,11,5,17,Regulation of Telephone Charges,23867,3967,85.7,14.7,50%+1,P,Supervisors,supervisors,Charter Amendment,"To fix and determine by ordinance in the month of February of each year, to take effect on the first day of July thereafter, rates or compensation to be collected for the use of water, heat, light, power or telephonic service.",https://sfpl.org/index.php?pg=2000027201&propid=17
11/5/1907,1907,11,5,18,Establishment of a Playground Commission,25897,3575,87.8,12.2,50%+1,P,Supervisors,supervisors,Charter Amendment,"Relating to children's playgrounds and public recreation centers outside of Golden Gate Park, and creating a Playground Commission.",https://sfpl.org/index.php?pg=2000027201&propid=18
11/5/1907,1907,11,5,19,Board of Health; Members; Appointment to Board and Terms of Office,20019,7131,73.7,26.3,50%+1,P,Supervisors,supervisors,Charter Amendment,"Establish a Department of Health, under the management of the Board of Health, which will consist of seven members, to be appointed by the Mayor.   Members of the Board to serve without compensation and adopt rules and regulations as necessary for the government of the board.",https://sfpl.org/index.php?pg=2000027201&propid=19
11/5/1907,1907,11,5,20,Salaries of Members of Police Department,23095,17382,57.0,43.0,50%+1,P,Supervisors,supervisors,Charter Amendment,"Captains shall receive an annual salary of $2400; Lieutenants,  an annual salary of $1920; Sergeants, an annual salary of $1680; Corporals, an annual salary of $1560; Uniformed officers, an annual salary of $1464. The police force shall not exceed one officer for each 500 residents.",https://sfpl.org/index.php?pg=2000027201&propid=20
11/5/1907,1907,11,5,21,Salaries of Members and Chief of Department of Electricity,18862,10894,63.3,36.7,50%+1,P,Supervisors,supervisors,Charter Amendment,"Board of Fire Commissioners and Board of Police Commissioners to elect an electrician, who will have general supervision of the Department of Electricity and will receive an annual salary of $3,000.  The number and compensation of assistants and employees of the Department of Electricity will be fixed annually by the Supervisors.",https://sfpl.org/index.php?pg=2000027201&propid=21
5/11/1908,1908,5,11,1,"Auxiliary Water System Bonds, $5,200,000",21488,1636,92.9,7.1,66 2/3%,P,Supervisors,supervisors,Bond Issue,"To incur a bonded indebtedness of $5,200,000 for an auxiliary water system for the City.",https://sfpl.org/index.php?pg=2000027201&propid=22
5/11/1908,1908,5,11,2,"Sewer System Bonds, $4,000,000",21401,1645,92.8,7.2,66 2/3%,P,Supervisors,supervisors,Bond Issue,"To incur a bonded indebtedness of $4,000,000 for the construction of a sewerage system for the City.",https://sfpl.org/index.php?pg=2000027201&propid=23
5/11/1908,1908,5,11,3,"Public School Buildings Bonds, $3,000,000",21397,1701,92.6,7.4,66 2/3%,P,Supervisors,supervisors,Bond Issue,"To incur a bonded indebtedness of $3,000,000 for the construction of new public school buildings in the City.",https://sfpl.org/index.php?pg=2000027201&propid=24
5/11/1908,1908,5,11,4,"Hospital Bonds, $2,000,000",21263,1733,92.6,7.6,66 2/3%,P,Supervisors,supervisors,Bond Issue,"To incur a bonded indebtedness of $2,000,000 for construction and improvement to the public hospitals in the City.",https://sfpl.org/index.php?pg=2000027201&propid=25
5/11/1908,1908,5,11,5,"Hall of Justice and Jail Bonds, $1,000,000",21133,1875,91.8,8.2,66 2/3%,P,Supervisors,supervisors,Bond Issue,"To incur a bonded indebtedness of $1,000,000 for the construction of a Hall of Justice and a jail facility in the City.",https://sfpl.org/index.php?pg=2000027201&propid=26
5/11/1908,1908,5,11,6,"Sanitary Reduction Work Bonds, $1,000,000",20653,2423,89.4,10.6,66 2/3%,P,Supervisors,supervisors,Bond Issue,"To incur a bonded indebtedness of $1,000,000 for the construction of a garbage disposal plant and to change the methods of the current sanitary system in the City.",https://sfpl.org/index.php?pg=2000027201&propid=27
11/12/1908,1908,11,12,1,Hetch Hetchy Project Authorization,34950,5708,85.9,14.1,50%+1,P,Supervisors,supervisors,Charter Amendment,"Shall the City be authorized to purchase as a public utility, a water supply system and water works in the Hetch Hetchy Valley to furnish the City and its inhabitants with a sufficient supply of good, pure water for all purposes?",https://sfpl.org/index.php?pg=2000027201&propid=28
11/12/1908,1908,11,12,2,"Hetch Hetchy, Tuolumne River, Lake Eleanor Project Bonds, $600,000",34572,5647,86.4,13.6,66 2/3%,P,Supervisors,supervisors,Bond Issue,"To incur a bonded indebtedness of $600,000 for the purchase of lands, rights and claims to and adjacent to the Hetch Hetchy Valley and Lake Eleanor for the purpose of the construction of a water supply system and water works to furnish the City with a sufficient supply of good, pure water for all purposes. Requires a two-thirds vote to pass.",https://sfpl.org/index.php?pg=2000027201&propid=29
11/12/1908,1908,11,12,3,"County Line Water Company Purchase, $40,000",33897,5953,85.0,15.0,50%+1,P,Supervisors,supervisors,Charter Amendment,"To authorize the City to spend $40,000 on the purchase of the property and operations of the County Line Water Company used in supplying a portion of  the City with water.",https://sfpl.org/index.php?pg=2000027201&propid=30
6/22/1909,1909,6,22,1,New City Hall,12807,10498,54.9,45.1,66 2/3%,F,Supervisors,supervisors,Bond Issue,"To incur a bonded indebtedness of $3,480,000 for the construction of a new City Hall and the purchase of four-and-a-half blocks new Market and Van Ness to constitute a Civic Center.",https://sfpl.org/index.php?pg=2000027201&propid=31
6/22/1909,1909,6,22,2,"Polytechnic High School Bond Issue, $600,000",17979,5210,77.5,22.5,66 2/3%,P,Supervisors,supervisors,Bond Issue,"To incur a bonded indebtedness of $600,000 for the construction of Polytechnic High School",https://sfpl.org/index.php?pg=2000027201&propid=32
6/22/1909,1909,6,22,3,"Juvenile Detention Home Bond Issue, $160,000",14950,8253,64.4,35.6,66 2/3%,F,Supervisors,supervisors,Bond Issue,"To incur a bonded indebtedness of $160,000 for the construction of a juvenile detention home.",https://sfpl.org/index.php?pg=2000027201&propid=33
6/22/1909,1909,6,22,4,"Telegraph Hill Public Park Bond Issue, $250,000",14334,8784,62.0,37.8,66 2/3%,F,Supervisors,supervisors,Bond Issue,"To incur a bonded indebtedness of $250,000 for the acquisition of lands on Telegraph Hill for the construction of a public park.",https://sfpl.org/index.php?pg=2000027201&propid=34
6/22/1909,1909,6,22,5,"Potrero Public Park Bond Issue, $400,000",14243,8941,61.4,38.6,66 2/3%,F,Supervisors,supervisors,Bond Issue,"To incur a bonded indebtedness of $400,000 for the acquisition of land in the Potrero neighborhood near Kansas, 20th and Connecticut for the construction of a public park.",https://sfpl.org/index.php?pg=2000027201&propid=35
6/22/1909,1909,6,22,6,"Aquatic Park Bond Issue, $500,000",14466,8755,62.2,37.8,66 2/3%,F,Supervisors,supervisors,Bond Issue,"To incur a bonded indebtedness of $500,000 for the acquisition of lands at the northern terminal of Van Ness Avenue for the construction of a public aquatic park.",https://sfpl.org/index.php?pg=2000027201&propid=36
6/22/1909,1909,6,22,7,"Bay View Public Park Bond Issue, $25,000",14215,8805,61.7,38.3,66 2/3%,F,Supervisor,supervisor,Bond Issue,"To incur a bonded indebtedness of $25,000 for the acquisition of the Bay View near the railroad and 32nd Avenue.",https://sfpl.org/index.php?pg=2000027201&propid=37
6/22/1909,1909,6,22,8,"Noe Valley Public Playground Bond Issue, $500,000",14861,8258,64.2,35.8,66 2/3%,F,Supervisor,supervisor,Bond Issue,"To incur a bonded indebtedness of $500,000 for the acquisition of land near Noe Street, Sanchez, Elizabeth and 24th Street.",https://sfpl.org/index.php?pg=2000027201&propid=38
6/22/1909,1909,6,22,9,"Glen Park Public Park Bond Issue, $90,000",13451,9560,58.4,41.6,66 2/3%,F,Supervisors,supervisors,Bond Issue,"To incur a bonded indebtedness of $90,000 for the acquisition of lands in the Glen Park District for a public park",https://sfpl.org/index.php?pg=2000027201&propid=39
6/24/1909,1909,6,24,1,"Municipal (MUNI) Street Railway -- Gray Street Bond Issue, $1,950,000",14404,7805,64.8,35.2,66 2/3%,F,Supervisors,supervisors,Bond Issue,"To incur a bonded indebtedness of $1,950,000 for the acquisition and construction of a public utility namely the Municipal Street Railway along Gray Street.",https://sfpl.org/index.php?pg=2000027201&propid=40
1/14/1910,1910,1,14,1,Lake Eleanor Bonds,32886,1609,95.3,4.7,66 2/3%,P,Supervisors,supervisors,Bond Issue,"To incur a bonded debt of City and County of San Francisco to the amount of $45,000,000 for the purpose of acquisition, construction and completion of a water supply and works to be owned and controlled by the City and County of San Francisco.",https://sfpl.org/index.php?pg=2000027201&propid=41
1/14/1910,1910,1,14,2,Spring Valley System,22068,11722,65.3,34.7,66 2/3%,F,Supervisor,supervisor,Bond Issue,"To incur a bonded debt of $35,000,000 to purchase water supply, works and property of Spring Valley Water Company.",https://sfpl.org/index.php?pg=2000027201&propid=42
11/15/1910,1910,11,15,1,Panama-Pacific International Exposition,42024,2122,95.1,4.9,50%+1,P,Supervisors,supervisors,Charter Amendment,"Providing $5,000,000 city bonds for the exposition.",https://sfpl.org/index.php?pg=2000027201&propid=43
11/15/1910,1910,11,15,2,Library Trustees,11539,27813,29.3,70.7,50%+1,F,Supervisors,supervisors,Charter Amendment,Giving the Mayor the appointment of Library Trustees.,https://sfpl.org/index.php?pg=2000027201&propid=44
11/15/1910,1910,11,15,3,City Taxes,9753,27854,25.9,74.1,50%+1,F,Supervisor,supervisor,Charter Amendment,Abolishing the dollar limit in the rate of city taxes.,https://sfpl.org/index.php?pg=2000027201&propid=45
11/15/1910,1910,11,15,4,Public Utilities,11186,26736,29.4,70.6,50%+1,F,Supervisors,supervisors,Charter Amendment,Enlarging power of city to acquire public utilities.,https://sfpl.org/index.php?pg=2000027201&propid=46
11/15/1910,1910,11,15,5,Municipal Record,18593,20045,48.1,51.9,50%+1,F,Supervisors,supervisors,Charter Amendment,Providing for the city advertising in Municipal Record,https://sfpl.org/index.php?pg=2000027201&propid=47
11/15/1910,1910,11,15,6,Petition Percentage,21651,17663,55.0,45.0,50%+1,P,Supervisors,supervisors,Charter Amendment,Reducing petition percentage for direct legislation and recall.,https://sfpl.org/index.php?pg=2000027201&propid=48
11/15/1910,1910,11,15,7,Majority Rule,33671,7469,81.8,18.2,50%+1,P,Supervisors,supervisors,Charter Amendment,Provides for majority rule and restores Australian ballot.,https://sfpl.org/index.php?pg=2000027201&propid=49
11/15/1910,1910,11,15,8,City Election Ballot,31380,8480,78.7,21.3,50%+1,P,Supervisors,supervisors,Charter Amendment,Eliminates the party circles from city election ballot.,https://sfpl.org/index.php?pg=2000027201&propid=50
11/15/1910,1910,11,15,9,Term Limits For Supervisors,21108,11130,65.4,34.6,50%+1,P,Supervisors,supervisors,Charter Amendment,Four-year term: half Supervisors elected every two years.,https://sfpl.org/index.php?pg=2000027201&propid=51
11/15/1910,1910,11,15,10,Absence of City Officials,28411,10847,72.3,27.7,50%+1,P,Supervisors,supervisors,Charter Amendment,Enlarging the opportunity for absence of city officials.,https://sfpl.org/index.php?pg=2000027201&propid=52
11/15/1910,1910,11,15,11,Tunnel and Subway Construction,32432,7073,82.0,18.0,50%+1,P,Supervisors,supervisors,Charter Amendment,Provides for construction of tunnels and subways.,https://sfpl.org/index.php?pg=2000027201&propid=53
11/15/1910,1910,11,15,12,Tunnel and Subway Construction (Same As Number 11),31558,7301,81.2,18.8,50%+1,P,Supervisors,supervisors,Charter Amendment,Provides for construction of tunnels and subways.,https://sfpl.org/index.php?pg=2000027201&propid=54
11/15/1910,1910,11,15,13,Sewer Assessments,13005,24500,34.6,65.4,50%+1,F,Supervisors,supervisors,Charter Amendment,Exempting sewer assessments from 50 per cent property value clause.,https://sfpl.org/index.php?pg=2000027201&propid=55
11/15/1910,1910,11,15,14,Responsibility For Unaccepted Streets,27643,11243,71.0,29.0,50%+1,P,Supervisors,supervisors,Charter Amendment,Makes property owners responsible for unaccepted streets.,https://sfpl.org/index.php?pg=2000027201&propid=56
11/15/1910,1910,11,15,17,Construction of Park Museum,34490,4561,88.3,11.7,50%+1,P,Supervisors,supervisors,Charter Amendment,Permitting Academy of Sciences to build museum in Park.,https://sfpl.org/index.php?pg=2000027201&propid=57
11/15/1910,1910,11,15,18,Age Limit For Fire Auxiliary System Employees,19192,19009,50.2,49.8,50%+1,P,Supervisors,supervisors,Charter Amendment,Extending age limit of employees in the Auxiliary system.,https://sfpl.org/index.php?pg=2000027201&propid=58
11/15/1910,1910,11,15,19,Recall of Street Railroad Franchise,20465,17677,53.6,46.4,50%+1,P,Supervisors,supervisors,Charter Amendment,Permitting city to recall street railroad franchise.,https://sfpl.org/index.php?pg=2000027201&propid=59
11/15/1910,1910,11,15,20,Street Railroad Franchise Restrictions,17684,18921,48.3,51.7,50%+1,F,Supervisors,supervisors,Charter Amendment,Adding to restrictions of street railroad franchises.,https://sfpl.org/index.php?pg=2000027201&propid=60
11/15/1910,1910,11,15,21,Tax Levy For Playgrounds,12779,23851,34.8,65.2,50%+1,F,Supervisors,supervisors,Charter Amendment,Providing 4 to 6 cent tax levy for playgrounds.,https://sfpl.org/index.php?pg=2000027201&propid=61
11/15/1910,1910,11,15,22,Golden Gate Park Funds,16855,20504,45.1,54.9,50%+1,F,Supervisors,supervisors,Charter Amendment,Taking half Golden Gate Park funds for other parks.,https://sfpl.org/index.php?pg=2000027201&propid=62
11/15/1910,1910,11,15,23,Municipal Work,10896,25697,29.7,70.3,50%+1,F,Supervisors,supervisors,Charter Amendment,Restricting municipal work to the day labor system.,https://sfpl.org/index.php?pg=2000027201&propid=63
11/15/1910,1910,11,15,24,Civil Service Commission Cost and Term,14234,22261,39.0,61.0,50%+1,F,Supervisor,supervisor,Charter Amendment,Adds to cost and alters form of Civil Service Commission.,https://sfpl.org/index.php?pg=2000027201&propid=64
11/15/1910,1910,11,15,25,Reducing City Office Hours,8662,28014,23.6,76.4,50%+1,F,Supervisors,supervisors,Charter Amendment,Provides leisure for tax eaters by reducing city office hours.,https://sfpl.org/index.php?pg=2000027201&propid=65
11/15/1910,1910,11,15,27,Fiscal Amendments,27383,10225,72.8,27.2,50%+1,P,Supervisors,supervisors,Charter Amendment,Makes fiscal amendments take effect first of fiscal year.,https://sfpl.org/index.php?pg=2000027201&propid=66
11/15/1910,1910,11,15,28,Raising Firemen Pensions,30460,8415,78.3,21.7,50%+1,P,Supervisors,supervisors,Charter Amendment,Raising pensions of firemen retired before year 1900.,https://sfpl.org/index.php?pg=2000027201&propid=67
11/15/1910,1910,11,15,29,Supervisors' Salaries,20709,17396,54.3,45.7,50%+1,P,Supervisors,supervisors,Charter Amendment,Raising the salaries of Supervisors to $200 a month.,https://sfpl.org/index.php?pg=2000027201&propid=68
11/15/1910,1910,11,15,30,Salaries and Positions in Registrar's Office,12353,26550,31.7,68.3,50%+1,F,Supervisors,supervisors,Charter Amendment,More positions and higher salaries in Registrar's office.,https://sfpl.org/index.php?pg=2000027201&propid=69
11/15/1910,1910,11,15,31,Raising Salaries,10109,28374,26.2,73.8,50%+1,F,Supervisors,supervisors,Charter Amendment,Raising salaries of certain employees in Tax Collector's office.,https://sfpl.org/index.php?pg=2000027201&propid=70
11/15/1910,1910,11,15,32,Board of Works -- Positions and Money,8797,29697,22.8,77.2,50%+1,F,Supervisors,supervisors,Charter Amendment,New positions and more money for the Board of Works.,https://sfpl.org/index.php?pg=2000027201&propid=71
11/15/1910,1910,11,15,33,Board of Health -- Positions and Money,9471,29478,24.3,75.7,50%+1,F,Supervisors,supervisors,Charter Amendment,New positions and more money for the Board of Health.,https://sfpl.org/index.php?pg=2000027201&propid=72
11/15/1910,1910,11,15,34,Department of Electricity -- Salaries,8257,29648,21.7,78.3,50%+1,F,Supervisors,supervisors,Charter Amendment,Higher and more salaries in Department of Electricity.,https://sfpl.org/index.php?pg=2000027201&propid=73
11/15/1910,1910,11,15,35,Recorder's Salaries,21118,18163,53.7,46.3,50%+1,P,Supervisors,supervisors,Charter Amendment,Reducing piece rate and increasing salaries in Recorder's office.,https://sfpl.org/index.php?pg=2000027201&propid=74
11/15/1910,1910,11,15,36,Assessor's Office -- Positions and Salaries,19324,19674,49.5,50.5,50%+1,F,Supervisors,supervisors,Charter Amendment,New positions and higher salaries in Assessor's office.,https://sfpl.org/index.php?pg=2000027201&propid=75
11/15/1910,1910,11,15,37,Taxes For Public Schools,15027,23567,38.9,61.1,50%+1,F,Supervisors,supervisors,Charter Amendment,Adding to the portion of taxes for the public schools.,https://sfpl.org/index.php?pg=2000027201&propid=76
11/15/1910,1910,11,15,38,Minimum Wage For City Work,20972,19367,51.9,48.1,50%+1,P,Supervisors,supervisors,Charter Amendment,Making $3 minimum day's wage on all the city work.,https://sfpl.org/index.php?pg=2000027201&propid=77
11/15/1910,1910,11,15,39,Police Patrol Drivers' Salaries,15256,24681,39.9,60.1,50%+1,F,Supervisors,supervisors,Charter Amendment,Raising the salaries of the police patrol drivers.,https://sfpl.org/index.php?pg=2000027201&propid=78
3/28/1912,1912,3,28,,City Hall Bonds,45129,4035,91.7,8.3,,P,Supervisors,supervisors,Bond Issue,Whether bonds are to be issued with which to build a new City Hall and to acquire land adjacent to it upon which will be constructed the San Francisco civic center.,https://sfpl.org/index.php?pg=2000027201&propid=80
12/10/1912,1912,12,10,1,Establishing a Civic Center,50210,24145,67.5,32.5,50%+1,P,Supervisors,supervisors,Charter Amendment,"Board of Supervisors to acquire land bounded by Market Street, Golden Gate Avenue and Franklin Street, for the purpose of establishing a Civic Center. The Board may also authorize the erection of an auditorium by the Panama-Pacific International Exposition Company, or of an opera house, museum, or other structure, provided the ownership of such structure will be vested in the municipality.",https://sfpl.org/index.php?pg=2000027201&propid=81
12/10/1912,1912,12,10,2,Panama-Pacific International Exposition Site,47962,24720,65.9,34.1,50%+1,P,Supervisors,supervisors,Charter Amendment,"Board of Supervisors to pass ordinances relating to use and closing of streets; the use, alteration, demolition and control of buildings; installation of water, gas, steam, sewerage and other pipes; use and control of electric light, power; maintenance and control of fire and police protection; any portion of the City and County of San Francisco which has been or may be selected as the site for the holding of the Panama-Pacific International Exposition.",https://sfpl.org/index.php?pg=2000027201&propid=82
12/10/1912,1912,12,10,3,Establishment of Civil Service Commission,44403,30522,59.2,40.8,50%+1,P,Supervisors,supervisors,Charter Amendment,"The Mayor will appoint three persons as Civil Service Commissioners, who will constitute the Civil Service Commission.   Each of the Commissioners will receive an annual salary of $1200.  Supervisors will appropriate annually not less than $12,500 for the expenses of the Commission, and not less than $5,000 additional for the inspection service.",https://sfpl.org/index.php?pg=2000027201&propid=83
12/10/1912,1912,12,10,4,Elected City Officials,14779,58153,20.2,79.8,50%+1,F,Supervisors,supervisors,Charter Amendment,"All these officials will be elected by the people: Assessor - term of four years, annual salary $8000;  Coroner- term of four years,  also control the Morgue, annual salary of $5,000; Recorder - term of four years, annual salary $5,000; County Clerk  - term of four years, annual salary $5,000;  Sheriff  - term of four years, annual salary $8,000 exclusive of the compensation received for delivery of prisoners and the insane.",https://sfpl.org/index.php?pg=2000027201&propid=84
12/10/1912,1912,12,10,5,Fire Department Company Composition,33644,46178,42.1,57.9,50%+1,F,Supervisors,supervisors,Charter Amendment,"Relating to the composition and duty shifts of the following: Fire Engine Company, Truck Company, Combination Chemical Company, Chemical Company, Water Tower Company, Fire Boat Company, Monitor Battery.",https://sfpl.org/index.php?pg=2000027201&propid=85
12/10/1912,1912,12,10,6,Acquisition and Ownership of Public Utilities,20719,49975,29.3,70.7,50%+1,F,Supervisors,supervisors,Charter Amendment,"The Board of Supervisors is empowered to provide by ordinance for the acquisition, construction, extension or condemnation of any public utility and to meet the costs of such acquisition by either issuance of bonds, by a special tax levy or by a tax on assessed property to be used solely for the purpose of construction of public utilities.",https://sfpl.org/index.php?pg=2000027201&propid=86
12/10/1912,1912,12,10,7,"Regulations of Board of Elections Commissioners, Registrar of Voters and Deputy Registrar",26351,44551,37.1,62.9,50%+1,F,Supervisors,supervisors,Charter Amendment,"No Registrar, Deputy Registrar, or member of the Board will, during the term of office be a member of any convention, the purpose of which is to nominate candidates for office, nor hold any municipal office until one year after the end of the term; nor take part in any election except to vote, and when acting as Election Commissioner; nor act as officer of any election or primary election.",https://sfpl.org/index.php?pg=2000027201&propid=87
12/10/1912,1912,12,10,8,Elected City Officials,5855,63471,8.4,91.6,50%+1,F,Supervisors,supervisors,Charter Amendment,"All these officials will be elected by the people: Treasurer - term of four years, annual salary $5,000; Auditor- term of four years, annual salary $5,000;  Tax Collector  - term of two years until the eighth day of January 1914, thereafter, four years, annual salary $5,000; ""City Attorney"" - term of four years, annual salary $7,000.",https://sfpl.org/index.php?pg=2000027201&propid=88
12/10/1912,1912,12,10,9,Establishment of Department of Energy,7117,62296,10.2,89.8,50%+1,F,Supervisors,supervisors,Charter Amendment,Department of Electricity will have charge of the construction and maintenance of the Fire Alarm and Police Telegraph and Telephone Systems.,https://sfpl.org/index.php?pg=2000027201&propid=89
12/10/1912,1912,12,10,10,Chief of Police to Select Detectives,7089,63246,10.0,90.0,50%+1,F,Supervisors,supervisors,Charter Amendment,"Chief of Police to select detectives,  not to exceed one detective for each eighteen police officers. Chief to designate Captain of Detectives, annual salary,  $3,000; Lieutenant of Detectives, annual salary $2400; Detective Sergeants, annual salary $1800.",https://sfpl.org/index.php?pg=2000027201&propid=90
12/10/1912,1912,12,10,11,"Chief of Police, Duties and Responsibilities",5430,64600,10.1,89.9,50%+1,F,Supervisors,supervisors,Charter Amendment,"Chief of Police - appointed by Board of Police Commissioners for a term of four years, annual salary $6,000, have control of all members of Department, maintain and enforce law, control of City and County prisons.",https://sfpl.org/index.php?pg=2000027201&propid=91
12/10/1912,1912,12,10,12,City Expenses For Holiday Celebrations,32735,38024,46.2,53.8,50%+1,F,Supervisors,supervisors,Charter Amendment,"Establish limits on  the following holiday celebrations: National Independence - $2,500; Admission of the State of California into the Union - $1,000; Memorial Day - $500.",https://sfpl.org/index.php?pg=2000027201&propid=92
12/10/1912,1912,12,10,13,Appointed City Employees,41215,30474,57.4,42.6,50%+1,P,Supervisors,supervisors,Charter Amendment,"All persons appointed to office must be citizens of the United States, and must, during their employment, reside in the city and county, and must have resided for one year preceding their appointment.  Appointees whose duties are performed outside the city will not be subject to those requirements",https://sfpl.org/index.php?pg=2000027201&propid=93
12/10/1912,1912,12,10,14,City Indebtedness,15656,51913,23.1,76.9,50%+1,F,Supervisors,supervisors,Charter Amendment,"No indebtedness shall be incurred that, together with existing bonded indebtedness,  exceeds 15% (percent) of the assessed value of City and County property; provided that bonds-- issued for the Panama-Pacific Exposition and for the acquisition or construction of a water supply-- will be excluded when computing such existing bonded indebtedness.",https://sfpl.org/index.php?pg=2000027201&propid=94
12/10/1912,1912,12,10,15,"Property Tax Levy Date, Special Taxes",13039,54597,16.1,83.9,50%+1,F,Supervisors,supervisors,Charter Amendment,"On or before the first Monday of September of each year, the Board of Supervisors shall levy the amount of taxes for City purposes. A special tax may be levied for the following purposes: support of schools, construction of public buildings, acquisition of public utilities, acquisition of lands for city purposes, construction of tunnels, bridges and other permanent structures, repair of sewers, repair and maintenance of streets and for increases of salary or number of officials voted at any election.",https://sfpl.org/index.php?pg=2000027201&propid=95
12/10/1912,1912,12,10,16,Parks Tax,30194,38627,43.8,56.2,50%+1,F,Supervisors,supervisors,Charter Amendment,"The Board of Supervisors shall provide all necessary money for the maintenance, preservation and improvement of said parks, squares, avenues and grounds; annually levy a tax on all property in the City and County not exempt from taxation, not less than five cents nor more than ten cents for each on hundred dollars assessed valuation of property.",https://sfpl.org/index.php?pg=2000027201&propid=96
12/10/1912,1912,12,10,17,"Relief For Aged, Indigent and Infirm Volunteer Fire Department Fireman",35014,35216,49.8,50.2,50%+1,F,Supervisors,supervisors,Charter Amendment,"To allow a yearly sum, no greater than $7,500, for the relief of aged, indigent and infirm exempt firemen who served in the Volunteer Fire Department between the years of 1850 and 1866.",https://sfpl.org/index.php?pg=2000027201&propid=97
12/10/1912,1912,12,10,18,"Opening, Closing, Widening, Extending any Street, Lane, Alley, Etc.",41029,28379,59.1,40.9,50%+1,P,Supervisors,supervisors,Charter Amendment,"Board of Supervisors shall have the power to order the extending, widening, closing of any street, lane, alley, etc in the city.",https://sfpl.org/index.php?pg=2000027201&propid=98
12/10/1912,1912,12,10,19,"Tunnels, Subways and Viaducts",38873,29962,56.8,43.2,50%+1,P,Supervisors,supervisors,Charter Amendment,"Board of Supervisors are empowered to order construction of and construct any tunnel, subway or viaduct, in, on, under or over any accepted or unaccepted open public street, avenue, lane, alley, place or court within the City or County.",https://sfpl.org/index.php?pg=2000027201&propid=99
12/10/1912,1912,12,10,20,"Improvement of Streets, Procedures and Expenses",37492,30840,54.8,45.2,50%+1,P,Supervisors,supervisors,Charter Amendment,The methods for improvement of streets and procedures for expenses relating to same shall not be deemed exclusive. The Board of Supervisors by a vote of not less than two-thirds of its members may by ordinance substitute any method or procedure or amend any method or procedure.,https://sfpl.org/index.php?pg=2000027201&propid=100
12/10/1912,1912,12,10,21,"Improvement of Streets, Bonded Indebtedness",37955,30371,55.7,44.3,50%+1,P,Supervisors,supervisors,Charter Amendment,"Bonded indebtedness may be incurred and bonds issued approved by the voters, for the purpose of improvement of streets or any other kind of public work provided that the aggregate amount shall not exceed the amount of $500,000.",https://sfpl.org/index.php?pg=2000027201&propid=101
12/10/1912,1912,12,10,22,"Relief Home Tract, Rancho San Miguel",39118,29472,57.0,43.0,50%+1,P,Supervisors,supervisors,Charter Amendment,"The Board of Supervisors may sell a portion of the Relief Home Tract not adapted to public use, being a portion of the Rancho San Miguel.  The proceeds arising from such sale shall be used exclusively for the purchase of other lands adjoining the Relief Home Tract",https://sfpl.org/index.php?pg=2000027201&propid=102
12/10/1912,1912,12,10,23,Qualification For Elected or Appointed Office,34779,31856,52.1,47.9,50%+1,P,Supervisors,supervisors,Charter Amendment,"No political, religious or partisan qualifications shall be required for election or appointment to any office under the City and County.  The right to hold any office or position shall not be limited by sex.",https://sfpl.org/index.php?pg=2000027201&propid=103
12/10/1912,1912,12,10,24,"City Attorney, Collection of Taxes",38137,28905,56.8,43.2,50%+1,P,Supervisors,supervisors,Charter Amendment,"The City Attorney shall commence and prosecute actions for the collection of taxes, by request of the Assessor or Tax Collector.",https://sfpl.org/index.php?pg=2000027201&propid=104
12/10/1912,1912,12,10,25,Election of Justice of the Peace,30500,34111,47.2,52.8,50%+1,F,Supervisors,supervisors,Charter Amendment,"Justices of the Peace shall have and exercise all the powers given them by the General Laws of the State.  They shall receive compensation and may appoint such clerks, deputies and employees prescribed by such General Laws.",https://sfpl.org/index.php?pg=2000027201&propid=105
12/10/1912,1912,12,10,26,"Police Commission, Police Relief and Pension Fund",36062,33392,51.9,48.1,50%+1,P,Supervisors,supervisors,Charter Amendment,"The Board of Police Commissioners shall out of the Police Relief and Pension Fund, provide for the family of any officer, member or employee of the Police Department who has been killed while performing his duty or injured while performing his duty and died within one year from the date of the injury.",https://sfpl.org/index.php?pg=2000027201&propid=106
12/10/1912,1912,12,10,27,Permits To Engage In Sale of Liquor,14751,64139,18.6,81.4,50%+1,F,Supervisors,supervisors,Charter Amendment,Shall permits to engage in the sale of liquor at retail be granted within the districts of San Francisco. A district is defined as embracing not less than fifty (50) city blocks and shall be so arranged that no established election precinct shall be divided and that such district shall be composed of a single parcel of contiguous property.,https://sfpl.org/index.php?pg=2000027201&propid=107
12/10/1912,1912,12,10,28,"Board of Police Commissioners, Members, Secretary, Meetings",31971,36310,46.8,53.2,50%+1,F,Supervisors,supervisors,Charter Amendment,"Board of Police Commissioners will consist of three members, who will be appointed by the Mayor, and each of whom will receive an annual salary of $1,200.  The Board will elect a President, whose term is one year, and will appoint a Secretary, who will receive an annual salary of $2,400.  The Board will hold weekly meetings; the Secretary is responsible for keeping minutes of the proceedings.",https://sfpl.org/index.php?pg=2000027201&propid=108
12/10/1912,1912,12,10,29,"Board of Police Commissioners, Vacations and Leaves of Absence",15689,51931,23.2,76.8,50%+1,F,Supervisors,supervisors,Charter Amendment,"Board of Police Commissioners is empowered to make rules and regulations concerning discipline, leaves of absence and vacations without loss of pay for Department employees, provided that the Department employees have been employed in the Department continuously for twelve  months, and that the vacations not exceed a period of fifteen days.",https://sfpl.org/index.php?pg=2000027201&propid=109
12/10/1912,1912,12,10,30,Bureau of Chief of Supplies,35542,31569,52.9,47.1,50%+1,P,Supervisors,supervisors,Charter Amendment,"Provide for and regulate the purchase, storage and distribution of all supplies for various offices and departments",https://sfpl.org/index.php?pg=2000027201&propid=110
12/10/1912,1912,12,10,31,"Board of Police Commissioners, Investigations, Hearings, Subpoenas",36156,31275,53.6,46.4,50%+1,P,Supervisors,supervisors,Charter Amendment,"The Board of Police Commissioners shall have the power to initiate and conduct investigations, subpoena witnesses and hear testimony relating to all matters concerning the affairs of the Police Department.",https://sfpl.org/index.php?pg=2000027201&propid=111
12/10/1912,1912,12,10,32,Substation For Fire Alarm and Police Telegraph and Telephone System in Jefferson Square,38787,29432,56.8,43.2,50%+1,P,Supervisors,supervisors,Charter Amendment,Board of Supervisors shall be empowered by ordinance to establish substation for fire alarm and police telegraph and telephone system in Jefferson Square.,https://sfpl.org/index.php?pg=2000027201&propid=112
12/10/1912,1912,12,10,33,Department of Public Works shall be under the direction and management of the Director of Public Works.,27956,39933,41.1,58.9,50%+1,F,NA,na,Charter Amendment,"Provides that the Department of Public Works shall be under the direction and management of the Director of Public Works, who shall be appointed and hold office at the pleasure of the Mayor. The Director of Public Works shall be paid a salary to be fixed by the Board of Supervisors upon recommendation by the Mayor, not to exceed $15,000 a year. The Director of Works shall hold public meetings at least once a week, at which heads of bureaus shall be present, and advise concerning the work of the department. The Director of Works shall appoint a secretary at a salary of $250 a month.",https://sfpl.org/index.php?pg=2000027201&propid=113
12/10/1912,1912,12,10,34,"Franchises For Construction, Maintenance and Operation of Public Utilities",33814,36311,55.3,44.7,50%+1,P,Supervisors,supervisors,Charter Amendment,"Board of Supervisors shall have power to grant franchises for construction, maintenance and operation of street railways, gas, electric and water works, telephone systems and other public utilities upon, over, under or across the streets and public places of the City and County of San Francisco.",https://sfpl.org/index.php?pg=2000027201&propid=114
12/10/1912,1912,12,10,35,Levy of Taxes For Bonded Indebtedness,12673,51165,19.8,81.2,50%+1,F,Supervisors,supervisors,Charter Amendment,The Board of Supervisors at the time of levying the municipal tax shall levy another tax sufficient to pay the annual interest on all bonds sold or authorized to be sold and to provide for sinking fund payments under the terms of said bonds.,https://sfpl.org/index.php?pg=2000027201&propid=115
12/10/1912,1912,12,10,36,"Library Bonds, Authorization To Sell",35878,31677,53.1,46.9,50%+1,P,Supervisors,supervisors,Charter Amendment,"Board of Supervisors is authorized to sell certain bonds authorized at an election, and described as ""Library Bonds.""",https://sfpl.org/index.php?pg=2000027201&propid=116
12/10/1912,1912,12,10,37,Establishment of City Planning Commission,34355,33747,50.4,49.6,50%+1,P,Supervisors,supervisors,Charter Amendment,The City Planning Commission will devise plans for the improvement and beautification of San Francisco.  City Planning Commission members will not receive compensation and not be subject to any prohibition forbidding officials from holding more than one office or position.,https://sfpl.org/index.php?pg=2000027201&propid=117
4/23/1913,1913,4,23,1,Geary-Street Road Agreement,38086,21861,63.5,36.5,50%+1,P,Supervisors,supervisors,Proposition,Extending Geary and Sutter street car tracks to run through to the ferry.,https://sfpl.org/index.php?pg=2000027201&propid=118
4/22/1913,1913,4,22,2,Telephone Rate Schedule,30710,27801,52.4,47.6,50%+1,P,Supervisors,supervisors,Proposition,An ordinance fixing telephone rates,https://sfpl.org/index.php?pg=2000027201&propid=119
4/22/1913,1913,4,22,3,Recall of Police Judge Weller,30751,29927,50.6,49.4,50%+1,P,Supervisors,supervisors,Proposition,Recall of Police Judge Weller.,https://sfpl.org/index.php?pg=2000027201&propid=120
8/26/1913,1913,8,26,1,"Municipal Street Railway System Bonds, $3,500,000",51452,13782,78.8,21.2,66 2/3%,P,Supervisors,supervisors,Bond Issue,"To incur a bonded indebtedness of $3,500,000 for the acquisition and construction of any municipal street railway system from the Embarcadero to terminals at the Panama-Pacific International Exposition grounds, and the Presidio Military Reservation, and various other avenues.",https://sfpl.org/index.php?pg=2000027201&propid=121
3/16/1915,1915,3,16,1,Changing the Limit of Taxation For Various City Purposes,30184,20730,59.2,40.8,50%+1,P,Supervisors,supervisors,Charter Amendment,"Authorizes changing the limit of taxation in order to provide for cost of elections, increased expenses voted by the people, cost of School Department and Library, and various other city purposes.",https://sfpl.org/index.php?pg=2000027201&propid=122
3/16/1915,1915,3,16,2,City Stationery and Supplies,18623,31650,37.0,63.0,50%+1,F,Supervisors,supervisors,Charter Amendment,"All printed stationery and printed supplies furnished the City and County, except election ballots, shall bear the imprint of the label of the Allied Printing Trades Council.",https://sfpl.org/index.php?pg=2000027201&propid=123
3/16/1915,1915,3,16,3,Work and Supply Contracts,14545,34743,29.5,70.5,50%+1,F,Supervisors,supervisors,Charter Amendment,"Contracts for work and supplies may be awarded to other than the lowest bidder, provided the amount does not exceed 10% (percent) of the lowest bid and the work or articles are to be produced in industries established in San Francisco and performed under conditions fair to union labor, and under conditions of responsibility and expedition.",https://sfpl.org/index.php?pg=2000027201&propid=124
3/16/1915,1915,3,16,4,Municipal Powers Board of Supervisors,16145,28269,36.3,63.7,50%+1,F,Supervisors,supervisors,Charter Amendment,Provides for the exercise of municipal powers in accordance with provision of the State Constitution.,https://sfpl.org/index.php?pg=2000027201&propid=125
3/16/1915,1915,3,16,5,Reduction of Bonded Indebtedness,14144,31058,31.2,68.8,50%+1,F,Supervisors,supervisors,Charter Amendment,"Reduces the limit of bonded debt to 8% (percent) of assessed valuation, and exempts bonds issued for water supply and works in computing such indebtedness.",https://sfpl.org/index.php?pg=2000027201&propid=126
3/16/1915,1915,3,16,6,Payment of City Taxes,23387,23034,50.3,49.7,50%+1,P,Supervisors,supervisors,Charter Amendment,Authorizes the Supervisors to postpone time of payment of City and County taxes until the second Monday in January.,https://sfpl.org/index.php?pg=2000027201&propid=127
3/16/1915,1915,3,16,7,"Supply, Contracts, Open Market Purchases",16288,29655,35.4,64.6,50%+1,F,Supervisors,supervisors,Charter Amendment,"Modifies the system of making contracts for annual supplies, provides certain supplies may be contracted for shorter periods than one year or for immediate delivery, regulates non-contract purchases, provides for open market purchases at less price than bids submitted, reduces certified checks from 10% (percent) to 5%(percent) and a method of supplying supplies for works outside the City.",https://sfpl.org/index.php?pg=2000027201&propid=128
3/16/1915,1915,3,16,8,"Regulation of Water, Heat, Light, Telegraph and Telephone Appliances in Public Streets",16329,30046,35.2,64.8,50%+1,F,Supervisors,supervisors,Charter Amendment,"To regulate and control the location, quantity and quality of all appliances that furnish water, heat, light, power, telephonic and telegraphic service on the public streets and grounds of the City and County; to acquire, regulate and control any and all appliances for sprinkling and cleaning City and County streets, and for flushing sewers.",https://sfpl.org/index.php?pg=2000027201&propid=129
3/16/1915,1915,3,16,9,"City Advertising in Daily Paper, Municipal Records",17638,27846,38.7,61.3,50%+1,F,Supervisors,supervisors,Charter Amendment,"The Board of Supervisors shall contract for doing all or any portion of the advertising required by the City and County.  Advertising shall be defined as the advertising and publication of official reports, orders, etc, and all notices relating to City work.  The Board may publish a weekly newspaper called the ""Municipal Record,"" which will include all matters of municipal interest and shall be known as the ""official newspaper.""",https://sfpl.org/index.php?pg=2000027201&propid=130
3/16/1915,1915,3,16,10,Concerning Publication of Bills and Ordinances Prior To Passage,16736,28136,37.2,62.8,50%+1,F,Supervisors,supervisors,Charter Amendment,Reduces the number of publications of bills and ordinances prior to passage from five times to three times.,https://sfpl.org/index.php?pg=2000027201&propid=131
3/16/1915,1915,3,16,11,Civil Service Extension,16082,34904,31.5,68.5,50%+1,F,Supervisors,supervisors,Charter Amendment,"To confirm without examination all employees under civil service who have been employed by the City for more than one year and to make probationary, civil service employees who have served more than six months and less than one year.",https://sfpl.org/index.php?pg=2000027201&propid=132
3/16/1915,1915,3,16,12,Civil Service Promotional Lists,18907,27505,40.7,59.3,50%+1,F,Supervisors,supervisors,Charter Amendment,Requires civil service examination within sixty days after exhaustion or abolition of eligible list or creation of new position; requires certification of highest eligible; appointing power to express reasons for specifying sex requirement; all promotional lists to be abolished after three years.,https://sfpl.org/index.php?pg=2000027201&propid=133
3/16/1915,1915,3,16,13,City Retirement and Pension Plan For Municipal Employees Other Than Police and Fire Employees,13008,35548,26.7,73.3,50%+1,F,Supervisors,supervisors,Charter Amendment,"Authorizes the Supervisors to submit to the voters an ordinance providing for the retirement and pensioning of municipal employees other than members of the Police and Fire Departments, such ordinance to provide for a fund to be accumulated from contributions of employees and such contributions from the City and County as the voters may authorize.",https://sfpl.org/index.php?pg=2000027201&propid=134
3/16/1915,1915,3,16,14,Unemployment Fund,14077,34657,28.8,71.25,50%+1,F,Supervisors,supervisors,Charter Amendment,"Provides for a fund for the relief of unemployed, and a tax not to exceed one cent on each one hundred dollars assessed valuation and prescribing the method of expenditure.",https://sfpl.org/index.php?pg=2000027201&propid=135
3/16/1915,1915,3,16,15,Payment on Contracts,7487,37399,16.6,83.4,50%+1,F,Supervisors,supervisors,Charter Amendment,Provides that progress payments on contracts shall not exceed 90% (percent) of value of work performed instead of 75% (percent) as at present.,https://sfpl.org/index.php?pg=2000027201&propid=136
3/16/1915,1915,3,16,16,"Street Work, Street Improvement, Powers of Board of Supervisors",10207,33550,23.3,76.7,50%+1,F,Supervisors,supervisors,Charter Amendment,"The Board of Supervisors is empowered to adopt by an ordinance passed by the vote of at least three-fourths of its members any general law of the State of California now in force and effect, relating to and providing for street work or street improvements in municipalities, the cost and expense of such work; all powers and provisions shall be applicable to such work or improvements and to the cost and expense in the City and County of San Francisco.",https://sfpl.org/index.php?pg=2000027201&propid=137
3/16/1915,1915,3,16,17,"Street Grades, Methods For Changing, Delinquent Assessments",9445,34890,21.3,78.7,50%+1,F,Supervisors,supervisors,Charter Amendment,"Relates to method of collecting delinquent assessments in proceedings changing street grades; method for changing street grades shall not be exclusive, but Supervisors may provide for alternative methods.",https://sfpl.org/index.php?pg=2000027201&propid=138
3/16/1915,1915,3,16,18,Revolving Fund For Street Work On Unimproved Streets,14787,32335,31.3,68.7,50%+1,F,Supervisor,supervisor,Charter Amendment,"Bonds to the amount of $1,000,000 may be issued by a vote of the people to provide a ""Revolving Fund"" to be used for street work on unimproved streets.",https://sfpl.org/index.php?pg=2000027201&propid=139
3/16/1915,1915,3,16,19,City Expenses For Holiday Celebration,18546,28831,39.1,60.9,50%+1,F,Supervisors,supervisors,Charter Amendment,"Reduces from $2,500 to $1,500 the amount allowed for the celebration of the Fourth of July, and provides that $1,000 be divided between Admission Day and Columbus Day.",https://sfpl.org/index.php?pg=2000027201&propid=140
3/16/1915,1915,3,16,20,Tax For Publicity Purposes,18106,29247,38.2,61.8,50%+1,F,Supervisors,supervisors,Charter Amendment,"Gives Supervisors power to levy tax of not more than one cent of $100 of assessed valuation, to be used for publicity purposes.",https://sfpl.org/index.php?pg=2000027201&propid=141
3/16/1915,1915,3,16,21,"Superintendent of Schools, Member of Board of Education",25307,22054,53.4,46.6,50%+1,P,Supervisors,supervisors,Charter Amendment,"The Superintendent of Schools of the City and County shall be elected by the qualified electors at each gubernatorial election.  He shall be a member of the Board of Education and receive an annual salary of $4,000.",https://sfpl.org/index.php?pg=2000027201&propid=142
3/16/1915,1915,3,16,22,"Initiative, Referendum and Recall Petitions",22600,23420,49.1,50.9,50%+1,F,Supervisors,supervisors,Charter Amendment,"Protects initiative, referendum and recall petitions from misrepresentation and fraud and provides that no candidate shall contest at a recall election",https://sfpl.org/index.php?pg=2000027201&propid=143
3/16/1915,1915,3,16,23,Unclaimed Property,27787,19513,58.7,41.3,50%+1,P,Supervisors,supervisors,Charter Amendment,"All unclaimed property and money that has been in the custody of the Property Clerk for one year shall be sold at public auction (with the exception of firearms and other deadly weapons, which must be destroyed), after having been five times advertised in the official newspaper. Proceeds of such sales shall be paid into the treasury of the Police Relief and Pension Fund.",https://sfpl.org/index.php?pg=2000027201&propid=144
3/16/1915,1915,3,16,24,"Police Commission, Permit for the Sale of Liquor",18223,32956,35.6,64.4,50%+1,F,Supervisors,supervisors,Charter Amendment,Gives the Police Commission control over all places where liquor is sold in quantities less than two gallons instead of less than one quart as at present.,https://sfpl.org/index.php?pg=2000027201&propid=145
3/16/1915,1915,3,16,25,Parks Tax,15303,31948,32.3,67.7,50%+1,F,Supervisors,supervisors,Charter Amendment,"Increases the maximum tax levy for parks, etc., from seven cents to nine cents on each $100 of assessed valuation.",https://sfpl.org/index.php?pg=2000027201&propid=146
3/16/1915,1915,3,16,26,"Office of the Sheriff, Salary of Jail Guards",15273,34140,30.9,69.1,50%+1,F,Supervisors,supervisors,Charter Amendment,"Increases the salary of 22 jail guards in the Sheriff's Office from $600 to $900 each, per year.",https://sfpl.org/index.php?pg=2000027201&propid=147
3/16/1915,1915,3,16,27,"Police Department, Changes to Ranks and Salaries",13272,36161,26.8,73.2,50%+1,F,Supervisors,supervisors,Charter Amendment,"Provides for a Captain - annual salary of $3000, and Lieutenant of Detectives - annual salary of $2400,  to be appointed from the force at large; increases the number of lieutenants to three in 100 patrolmen instead of two in 100; increases the detective force by fifteen; abolishes grade of corporal and makes present corporals sergeants - annual salary of $1800.",https://sfpl.org/index.php?pg=2000027201&propid=148
3/16/1915,1915,3,16,28,Salary Increase of Copyists in Recorder's Office,16223,32456,33.3,66.7,50%+1,F,Supervisors,supervisors,Charter Amendment,"Increases the pay of copyists in the Recorder's Office from six to seven cents per folio (page), but salary shall not exceed $125 per month.",https://sfpl.org/index.php?pg=2000027201&propid=149
3/16/1915,1915,3,16,29,Salary Increase for Hydrantmen and Firemen on Fire Boats,11618,37937,23.4,76.6,50%+1,F,Supervisors,supervisors,Charter Amendment,Increases the salary of Hydrantmen and firemen on the fire boats from $1200 to $1440 per year for each.,https://sfpl.org/index.php?pg=2000027201&propid=150
3/16/1915,1915,3,16,30,Salary of the Members of the Board of Health,7820,40065,16.3,83.7,50%+1,F,Supervisors,supervisors,Charter Amendment,Gives the seven members of the Board of Health a yearly salary of $1200 each.,https://sfpl.org/index.php?pg=2000027201&propid=151
3/16/1915,1915,3,16,31,"Board of Election Commissioners, Candidate Regulations",7735,38151,16.8,83.2,50%+1,F,Supervisors,supervisors,Charter Amendment,"No member of the Board of Election Commissioners, nor the Registrar of Voters, nor the Deputy Registrar shall be a member of any convention to nominate candidates for office except they may be by resolution of Board of Supervisors elected to municipal office to frame or revise a municipal charter or elected as a delegate to a State Constitutional Convention.",https://sfpl.org/index.php?pg=2000027201&propid=152
3/16/1915,1915,3,16,32,"Secretary to Mayor, Salary Increase",3783,45239,7.7,92.3,50%+1,F,Supervisors,supervisors,Charter Amendment,Increases the salary of the Mayor's Secretary from $2400 to $3600 per year.,https://sfpl.org/index.php?pg=2000027201&propid=153
3/16/1915,1915,3,16,33,"Secretary of Board of Public Works, Salary Increase",4052,47670,7.8,92.2,50%+1,F,Supervisors,supervisors,Charter Amendment,Increases the salary of the Secretary of the Board of Public Works from $1800 to $3000 per year.,https://sfpl.org/index.php?pg=2000027201&propid=154
3/16/1915,1915,3,16,34,"Playground Commissioners, Term of Office",22572,24334,48.1,51.9,50%+1,F,Supervisors,supervisors,Charter Amendment,Fixes the term of office of Playground Commissioners from one to four years.,https://sfpl.org/index.php?pg=2000027201&propid=155
3/16/1915,1915,3,16,35,"City Property Exchange, Sutro Estate",18290,31084,37.0,63.0,50%+1,F,Supervisors,supervisors,Charter Amendment,"Permits the Board of Supervisors to exchange city property on Van Ness Avenue, between Fell and Hayes streets, for not less than 40 acres of Sutro Estate property north of Lincoln Park.",https://sfpl.org/index.php?pg=2000027201&propid=156
3/16/1915,1915,3,16,36,"Salary Increases, Municipal Employees, Dates to Begin",26879,20269,57.0,43.0,50%+1,P,Supervisors,supervisors,Charter Amendment,"Except as otherwise provided, all Charter amendments submitted and adopted, or all that may hereafter be adopted, that increase the salary of any municipal officer or employee shall not take effect until the end of the fiscal year in which such amendments are ratified by the Legislature of the State of California.",https://sfpl.org/index.php?pg=2000027201&propid=157
4/20/1915,1915,4,20,1,"Spring Valley Water Company Bond Acquisition, $34,5000,000",39951,33455,54.4,45.6,66 2/3%,F,Supervisors,supervisors,Bond Issue,"To incur a bonded indebtedness of $34,500,000 for the acquisition of the existing property and plant of the Spring Valley Water Company by the City in connection with and as part of the system of water supply heretofore authorized by the electors of the City on January 14, 1910, and known as the Lake Eleanor Tuolumne System.",https://sfpl.org/index.php?pg=2000027201&propid=158
11/7/1916,1916,11,7,8,"Prohibition of Loitering, Picketing, Carrying Signs or Speaking in a Loud Voice in Public Streets or Places",74028,68299,52.0,48.0,50%+1,F,Initiative,initiative,Ordinance,"It shall be unlawful for any person in or on any public street or place in the City to speak loud or cry out or proclaim for the purpose of influencing any person to refrain from entering any work or place of business, or for the purpose of influencing any person to refrain from purchasing any good or merchandise, or for the purpose of influencing any person to refrain from performing any work at any factory or business, or for the purpose of intimidating any person who is performing any work or seeking any work at any factory or business.",https://sfpl.org/index.php?pg=2000027201&propid=159
11/7/1916,1916,11,7,9,Prohibition of Public Speaking on Streets and in Public Parks,65446,68755,48.7,51.3,50%+1,F,Initiative,initiative,Ordinance,"It shall be unlawful for any person to make or deliver any public speech, lecture or address in any street or public park in the City except that such person shall apply for and receive a permit from the Board of Supervisors to do so.",https://sfpl.org/index.php?pg=2000027201&propid=160
11/7/1916,1916,11,7,10,Operation of Jitney Buses on City Streets,59573,79866,42.7,57.3,50%+1,F,Supervisors,supervisors,Ordinance,"Jitney Buses may operate on all City streets at all times, subject to such traffic regulations as the Police Department by law exercises over all vehicular traffic. Jitney buses must run to the end of the routes indicated by their terminal signals, but may take side or special trips on routes other than five or ten cent routes.",https://sfpl.org/index.php?pg=2000027201&propid=161
11/7/1916,1916,11,7,11,Creating the position of City and County Attorney in Place of City Attorney,31900,94567,25.2,74.8,50%+1,F,Supervisors,supervisors,Charter Amendment,"Provides for the creation of the position of ""City and County Attorney"" in place of the established ""City Attorney"" position, with a salary of $10,000 per year and to be appointed by the Mayor until January 8, 1922.",https://sfpl.org/index.php?pg=2000027201&propid=162
11/7/1916,1916,11,7,12,Election of Municipal Officers; Sample Ballots; Election Results,75390,44876,62.6,37.4,50%+1,P,Supervisors,supervisors,Charter Amendment,"Changes to ""municipal elections"" and elected officers required by the Charter; changes to the printing of the sample ballots including rotation of candidate names; changes to the counting of election returns and the determination of election results.",https://sfpl.org/index.php?pg=2000027201&propid=163
11/7/1916,1916,11,7,13,"Terms, Salary and Appointment of Police Judges",42253,84213,33.4,66.6,50%+1,F,Supervisors,supervisors,Charter Amendment,Providing for the appointment of Police Judges by the Mayor for six year terms and for night sessions of Police Court. Each judge shall receive an annual salary of $3600.,https://sfpl.org/index.php?pg=2000027201&propid=164
11/7/1916,1916,11,7,15,Tax Levy Refund,50318,61098,45.1,54.9,50%+1,F,Supervisors,supervisors,Charter Amendment,"To provide that when a tax levy made prior to the adoption of this amendment has been declared illegal by the California Supreme Court, all of the tax levy shall be refunded to property owners, regardless of whether protest has or has not been made. A special tax to refund the amount necessary may be levied.",https://sfpl.org/index.php?pg=2000027201&propid=166
11/7/1916,1916,11,7,16,Municipal Work Contracts; Eight Hour Day and $3.00 Per Day Minimum Wage,82851,42845,65.9,34.1,50%+1,P,Supervisors,supervisors,Charter Amendment,Provides that all contracts or sub-contracts for municipal work in California shall require an eight hour day and a $3.00 per day minimum wage for employment of San Francisco workers.,https://sfpl.org/index.php?pg=2000027201&propid=167
11/7/1916,1916,11,7,17,Gift of Public Aquarium,76428,45153,62.8,37.2,50%+1,P,Supervisors,supervisors,Charter Amendment,"Gives the Board of Supervisors power to accept a gift of a public aquarium and appropriate not less than $20,000 for maintenance of same.",https://sfpl.org/index.php?pg=2000027201&propid=168
11/7/1916,1916,11,7,18,Fireman's Relief Fund,63022,52490,54.5,45.4,50%+1,P,Supervisors,supervisors,Charter Amendment,Gives the Board of Fire Commissioners additional control of the Fireman's Relief Fund.,https://sfpl.org/index.php?pg=2000027201&propid=169
11/7/1916,1916,11,7,19,Police Relief and Pension Fund,60299,53514,52.9,47.1,50%+1,P,Supervisors,supervisors,Charter Amendment,Gives Board of Police Commissions additional control of the Police Relief and Pension Fund.,https://sfpl.org/index.php?pg=2000027201&propid=170
11/7/1916,1916,11,7,20,Contributions to Police Relief and Pension Fund,36625,75893,32.5,67.5,50%+1,F,Supervisors,supervisors,Charter Amendment,"The Treasurer shall retain from each member of the Police force, $2.00 per month which shall be paid into the Police Relief and Pension Fund. There shall be annual tax levied, collected and apportioned to the said fund to meet and pay all demands on the fund including any deficit that may exist for fiscal year ending June 30, 1917.",https://sfpl.org/index.php?pg=2000027201&propid=171
11/7/1916,1916,11,7,21,Salary Increase for Treasurer and Bookkeeper,13572,112487,10.7,89.3,50%+1,F,Supervisors,supervisors,Charter Amendment,Increases the annual salary of the Treasurer to $8000 from $4000 and the annual salary of the Bookkeeper to $2400 from $2100.,https://sfpl.org/index.php?pg=2000027201&propid=172
11/7/1916,1916,11,7,22,Land Acquisition Tax,33357,77558,30.0,70.0,50%+1,F,Supervisors,supervisors,Charter Amendment,"Authorizes the Board of Supervisors to submit to the voters an Ordinance providing for a special tax for the purchase of land or acquisition of improvements, and may extend over a number of years, not to exceed ten. A majority vote adopts the Ordinance.",https://sfpl.org/index.php?pg=2000027201&propid=173
11/7/1916,1916,11,7,23,School Lots Reserved Under Van Ness Ordinance,79496,38828,67.1,32.9,50%+1,P,Supervisors,supervisors,Charter Amendment,"Provides that certain school lots west of Arguello Boulevard and reserved under the provisions of the Van Ness Ordinance, may be sold and the proceeds to be used exclusively to purchase additions to new or existing sites for school purposes. The lots may be sold only when the Board of Education determines the lots are inadequate for school purposes.",https://sfpl.org/index.php?pg=2000027201&propid=174
11/7/1916,1916,11,7,24,"Protecting Initiative, Referendum and Recall Elections",83053,29840,73.5,26.5,50%+1,P,Supervisors,supervisors,Charter Amendment,"Provides for the protection of petitions for initiative, referendum and recall elections from fraud and forgery and to reduce the expense in verifying such petitions, and of such elections.",https://sfpl.org/index.php?pg=2000027201&propid=175
11/7/1916,1916,11,7,25,Filing of Bonds for Municipal Work Contracts,94816,22265,80.9,19.1,50%+1,P,Supervisors,supervisors,Charter Amendment,"Provides for bonds of contractors for contracts awarded for municipal and street work to protect persons furnishing materials, labor, etc., for such work.",https://sfpl.org/index.php?pg=2000027201&propid=176
11/7/1916,1916,11,7,26,Changes in Street Grades; Installment Payments for Assessments,66556,42628,60.9,39.1,50%+1,P,Supervisors,supervisors,Charter Amendment,Granting the Board of Supervisors by Ordinance to provide a procedure for changes to street grades and street work and providing for installment payments for assessments.,https://sfpl.org/index.php?pg=2000027201&propid=177
11/7/1916,1916,11,7,27,Procedures for Street Work; Limitations to Installment Payments,62403,42534,59.4,40.6,50%+1,P,Supervisors,supervisors,Charter Amendment,To provide additional power to Board of Supervisors by Ordinance to provide procedures for street work and for limiting the amount of installment payments of assessments.,https://sfpl.org/index.php?pg=2000027201&propid=178
11/7/1916,1916,11,7,28,Treasurer's Responsibilities Concerning Public Money,61843,47748,56.4,43.6,50%+1,P,Supervisors,supervisors,Charter Amendment,"To provide that written consent of the Auditor and the Chairman of the Finance Committee of the Board of Supervisors, in addition to that of the Mayor, be required to select depository of public money. The Treasurer shall be responsible for all deposits and records concerning public money. The Treasurer shall not be responsible for any loss of public money resulting from the deposit thereof when made in accordance with the provisions of this act.",https://sfpl.org/index.php?pg=2000027201&propid=179
11/7/1916,1916,11,7,29,Civil Service Extension,44526,74889,37.2,62.8,50%+1,F,Supervisors,supervisors,Charter Amendment,"To extend civil service to all departments and offices with some exceptions and to confirm without examination all employees under civil service who have been employed by the City for more than one year and to make probationary, civil service employees who have served more than six months and less than one year.",https://sfpl.org/index.php?pg=2000027201&propid=180
11/7/1916,1916,11,7,30,Establishes the Department of Weights and Measures,81893,39306,67.5,32.5,50%+1,P,Supervisors,supervisors,Charter Amendment,"Provides for the creation of the Department of Weights and Measures, following the State law and placing the Department under the Civil Service. The Sealer of Weights and Measures shall be appointed by the Board of Supervisors. The salary of the Sealer and all other Department employees shall be set by law.",https://sfpl.org/index.php?pg=2000027201&propid=181
11/7/1916,1916,11,7,31,Election of Police Judges; Mayor to Appoint Vacancies,39693,83158,32.3,67.7,50%+1,F,Supervisors,supervisors,Charter Amendment,Provides for the election of Police Judges for a term of six years and for the holding of night sessions of Police Court at the discretion of the Mayor. The Mayor shall appoint an eligible person to serve the unexpired term of a Police Judge in the event of a vacancy. The Mayor may also appoint one judge as presiding judge.,https://sfpl.org/index.php?pg=2000027201&propid=182
11/7/1916,1916,11,7,32,Salary Increase for Police Judges,17721,110859,13.7,86.3,50%+1,F,Supervisors,supervisors,Charter Amendment,Provides for an increase of salary of Police Judges from $300 to $400 per month.,https://sfpl.org/index.php?pg=2000027201&propid=183
11/7/1916,1916,11,7,33,Fire Department; Two Tours of Duty,80019,67675,54.1,45.9,50%+1,P,Supervisors,supervisors,Charter Amendment,"Provides for a two platoon system within the Fire Department, whereby firemen shall be on duty not to exceed 14 consecutive hours. Each period of 24 hours shall be divided up into two tours of duty - one from 8:00 AM to 6:00 PM and one from 6:00 PM to 8:00 AM. Officers and members shall alternate at intervals of not more than one week.",https://sfpl.org/index.php?pg=2000027201&propid=184
10/30/1917,1917,10,30,1,"Public School Bonds, $13,500,000",37619,7485,83.4,16.6,66 2/3%,P,Supervisors,supervisors,Bond Issue,"To incur a bonded indebtedness of $13,500,000 for the acquisition, construction, completion and equipment of permanent buildings and improvements for public schools and for the acquisition of necessary lands therefor.",https://sfpl.org/index.php?pg=2000027201&propid=185
11/5/1918,1918,11,5,26,Relief for Dependents of Soldiers and Sailors and Marines,24379,54974,30.7,69.3,50%+1,F,Supervisors,supervisors,Charter Amendment,"To create a fund to be known as the ""Fund for the relief of dependents of soldiers, sailors and marines now or hereafter serving in the Army or Navy of the United States in the war now being waged by the United States."" Board of Supervisors to levy a tax for three years of not less than two cents and not more than four cents on each $100 assessed valuation to be collected and deposited with the Treasurer for credit to said fund. A Commission is to be established by the Mayor to regulate the fund.",https://sfpl.org/index.php?pg=2000027201&propid=186
11/5/1918,1918,11,5,27,Acquisition of and Payment for Any Public Utility,33223,37799,46.7,53.3,50%+1,F,Supervisors,supervisors,Charter Amendment,To empower the Board of Supervisors to adopt by ordinance of two thirds of the members procedures for acquisition of and payment for public utilities for the City. To call for an election to adopt an ordinance for the acquisition and payment of any public utility to be approved by two thirds of the qualified electors at such election.,https://sfpl.org/index.php?pg=2000027201&propid=187
11/5/1918,1918,11,5,28,Pension of Fire Department and Police Department Members Serving in the Armed Forces,44615,32881,57.5,42.5,50%+1,P,Supervisors,supervisors,Charter Amendment,Fire Department members who are serving in the military or naval forces of United States in any war shall not be deemed to be in absence from the Department as far as continuity of service is required for pension entitlement.,https://sfpl.org/index.php?pg=2000027201&propid=188
11/5/1918,1918,11,5,29,"Municipal Employees, Leaves of Absence for Military or Naval Service",49882,24847,66.7,33.3,50%+1,P,Supervisors,supervisors,Charter Amendment,"Persons who are serving in the Army or Navy of the United States as of April 6, 1917 shall be granted a leave of absence from their municipal position and shall retain their Civil Service standing with certain provisions.",https://sfpl.org/index.php?pg=2000027201&propid=189
11/5/1918,1918,11,5,30,Civil Service Commission; Standardization of Compensation; Elimination of Positions,34846,35917,49.2,50.8,50%+1,F,Supervisors,supervisors,Charter Amendment,Civil Service Commission to be empowered to standardize salaries and base the standardization on the importance of the duties of the position and the efficiency and length of service of the employee; to abolish unnecessary positions where investigation shows the work can be consolidated with other positions; to make temporary or permanent transfers of employees covering similar duties and compensation.,https://sfpl.org/index.php?pg=2000027201&propid=190
11/5/1918,1918,11,5,31,Method of Counting Votes at Elections,35196,34515,50.4,49.6,50%+1,P,Supervisors,supervisors,Charter Amendment,"Ballots cast at precincts shall not be counted at the precinct but shall be locked as soon as the polls are closed. Boxes shall be sent with not less than two precinct officers to the Registrar of Voters Office. Boxes shall be labeled and Registrar of Voters shall provide the methods for counting, tallying and certifying each vote cast.",https://sfpl.org/index.php?pg=2000027201&propid=191
11/5/1918,1918,11,5,32,Power to Impose License Taxes,18267,51201,26.2,73.8,50%+1,F,Supervisors,supervisors,Charter Amendment,License taxes shall be imposed for purposes of regulation and collection of and revenue generated from shall be provided to the City.,https://sfpl.org/index.php?pg=2000027201&propid=192
11/5/1918,1918,11,5,33,"Permits for Pawnbrokers, Peddlers and Similar Callings",37798,34196,52.5,47.5,50%+1,P,Supervisors,supervisors,Charter Amendment,"To empower the Board of Supervisors to grant or refuse to grant permits to any person engaged or desiring to engage in business as a pawnbroker, peddler, junk-shop keeper, used merchandise dealer, auctioneer or similar business or calling. Such permits may be subject to inspection and complaints to revoke must be in writing.",https://sfpl.org/index.php?pg=2000027201&propid=193
11/5/1918,1918,11,5,34,"Acceptance of Gift of Ignatz Steinhart, Deceased, for Erection and Completion of an Aquarium",57410,19064,75.0,25.0,50%+1,P,Supervisors,supervisors,Charter Amendment,"To empower the Board of Supervisors to accept the gift of Ignatz Steinhart, deceased, in  the amount of $250,000 for the erection and completion of and Aquarium to be located in Golden Gate Park for the use and enjoyment of the people. To accept the management and operation of the Aquarium to be under the direction of the California Academy of Sciences.",https://sfpl.org/index.php?pg=2000027201&propid=194
11/5/1918,1918,11,5,35,"Establishment of Markets, Abattoirs, Pipelines, Reservoirs and Other Similar Utilities",28817,43040,40.1,59.9,50%+1,F,Supervisors,supervisors,Charter Amendment,"The City shall have the right and power to purchase, lease, construct, condemn and establish, own, maintain and operate the following utilities: markets, markethouses, depots, coal and fuel yards, oil stations, pipelines, reservoirs, cattle yards, abattoirs, storage plants, ice plants, elevators, warehouses, shipping facilities, delivery services and any and all lands, buildings structures, equipment, etc., for the operation of such utilities.",https://sfpl.org/index.php?pg=2000027201&propid=195
11/5/1918,1918,11,5,36,"School Lots Reserved Under Ordinance No. 800 of March 27, 1868",38757,26410,59.4,40.6,50%+1,P,Supervisors,supervisors,Charter Amendment,"Provides that certain school lots west of Arguello Boulevard and reserved under the provisions of Ordinance No. 800, may be sold and the proceeds to be used exclusively to purchase additions to new or existing sites for school purposes. The lots may be sold only when the Board of Education determines the lots are inadequate for school purposes.",https://sfpl.org/index.php?pg=2000027201&propid=196
11/5/1918,1918,11,5,37,Board of Education to Oversee School Department,27684,53040,34.2,65.8,50%+1,F,Initiative,initiative,Charter Amendment,School Department shall be under the control of the Board of Education. The Board of Education shall be composed of seven members appointed by the Mayor and shall serve without compensation. The Board shall elect one of its number President. The Board shall meet at least twice a month and establish rules for its proceedings. Records of its proceedings shall be considered public records.,https://sfpl.org/index.php?pg=2000027201&propid=197
11/5/1918,1918,11,5,38,City Payments to be Authorized by Auditor,35870,32020,52.8,47.2,50%+1,P,Supervisors,supervisors,Charter Amendment,No contracts shall be made nor assessments paid unless the Auditor shall indorse his certificate that a balance of the appropriation or fund applicable is sufficient to pay the estimated expense of executing such contract or such assessment.,https://sfpl.org/index.php?pg=2000027201&propid=198
11/5/1918,1918,11,5,39,Board of Supervisors to Authorize Payment of Compensation for Public Work,36785,31802,53.6,46.4,50%+1,P,Supervisors,supervisors,Charter Amendment,"The Supervisors may by ordinance authorize and provide for the payment through the agency of any regularly licensed bank in the State of California of wages, salaries or  compensation due to any person or persons engaged on public work in the City.",https://sfpl.org/index.php?pg=2000027201&propid=199
11/5/1918,1918,11,5,40,Board of Public Works to Oversee Operation of all City-Owned Public Utilities,35655,34783,50.6,49.4,50%+1,P,Supervisors,supervisors,Charter Amendment,"The Board of Public Works shall have charge and control of all construction, maintenance and operation of any and all public utilities owned, controlled or operated by the City.",https://sfpl.org/index.php?pg=2000027201&propid=200
11/5/1918,1918,11,5,41,Sale of Bonds for Less Than Par,31019,38398,44.6,55.4,50%+1,F,Supervisors,supervisors,Charter Amendment,The Board of Supervisors is authorized to sell all bonds below the par or face value. Such price shall not be less than that which will net the purchaser 5 1/2 % (percent) interest per year according to the standard table of bond values.,https://sfpl.org/index.php?pg=2000027201&propid=201
11/5/1918,1918,11,5,42,Limit of Bonded Indebtedness,23525,43994,34.8,65.2,50%+1,F,Supervisors,supervisors,Charter Amendment,"No indebtedness shall be incurred for the acquisition, construction or completion of any public utility which together with the existing bonded indebtedness of the City shall exceed at any one time 10% (percent) of the assessed value of all real and personal property in the City. Any bonded indebtedness incurred for the acquisition, construction or completion of any earning public utility will be exempt from this section.",https://sfpl.org/index.php?pg=2000027201&propid=202
11/5/1918,1918,11,5,43,Playground Commissioners; Term of Office,32242,33912,48.7,51.3,50%+1,F,Supervisors,supervisors,Charter Amendment,"Playground Commissioners shall be seven in number, five of whom shall be appointed by the Mayor for a term of four years. Three of the members appointed by the Mayor shall be men and two shall be women. The President of the Board of Education shall be the sixth member and either the President of the Park Commission or the Superintendent of Golden Gate Park shall be the seventh member. None of the Commissioners shall receive compensation for his or her services.",https://sfpl.org/index.php?pg=2000027201&propid=203
11/5/1918,1918,11,5,44,Gateman and Hydrantman Positions in the Fire Department,32878,38100,46.3,53.7,50%+1,F,Supervisors,supervisors,Charter Amendment,Any person who has served in the position of gateman or hydrantman in the Fire Department for a period of one year continuously is hereby declared to be appointed to the position and to be entitled to all the benefits of the position.,https://sfpl.org/index.php?pg=2000027201&propid=204
11/5/1918,1918,11,5,45,Civil Service Extension,21530,49895,30.1,69.9,50%+1,F,Supervisors,supervisors,Charter Amendment,To allow for any person serving in any position in any of the offices or departments included in this amendment for a period of one year continuously and who shall be employed in said offices at the approval of this amendment shall be declared to be appointed to the position according to the provisions of this Charter and to be entitled to all the benefits of the position.,https://sfpl.org/index.php?pg=2000027201&propid=205
11/5/1918,1918,11,5,46,Police Patrol Drivers,42546,37467,53.1,46.9,50%+1,P,Supervisors,supervisors,Charter Amendment,"In addition to the Police Force, there shall be three patrol drivers for each police company. Each patrol driver shall receive a yearly salary of not less than $1464 and for purposes of a pension shall be considered part of the Police Force.",https://sfpl.org/index.php?pg=2000027201&propid=206
11/5/1918,1918,11,5,47,Salary Increase for Uniformed Force of Police Department,48769,41504,54.0,46.0,50%+1,P,Supervisors,supervisors,Charter Amendment,"The following positions shall receive annual salaries in the following amounts: Chief Clerk, Property Clerk, Captain - $2640; Lieutenants - $2160; Sergeants - $1920; Corporals - $1800; Captain of Detectives - $3000; Uniformed Officers - $1704.",https://sfpl.org/index.php?pg=2000027201&propid=207
11/5/1918,1918,11,5,48,Salary Increase for Officers and Members of Fire Department,59805,32836,64.5,35.5,50%+1,P,Supervisors,supervisors,Charter Amendment,"Fire Department members who receive an annual salary of $1860 or less shall during the five years commencing on July 1, 1919, receive $20 per month in addition to the salaries specified.",https://sfpl.org/index.php?pg=2000027201&propid=208
11/2/1920,1920,11,2,21,Charge for Excavation of Sub-Sidewalk Areas of Public Streets,40096,79107,33.6,66.4,50%+1,F,Mayor,mayor,Ordinance,"Every person who excavates, or maintains an area extending into such street, shall be required to pay for the use of such area, a sum equal to four percent of the amount produced by multiplying the number of square feet of such area by a sum equal to 1/10 of the land value of the average square foot of the lot abutting such area.",https://sfpl.org/index.php?pg=2000027201&propid=209
11/2/1920,1920,11,2,22,Organ Recitals at Exposition Auditorium,61581,57892,51.5,48.5,50%+1,P,Supervisors,supervisors,Ordinance,"The Board of Supervisors shall arrange and provide for a weekly series of organ recitals at Exposition Auditorium whenever said building is available. An organist shall be employed and paid for his services at $100 for each recital where an admission fee is charged not to exceed $5,000 in any one year.",https://sfpl.org/index.php?pg=2000027201&propid=210
11/2/1920,1920,11,2,23,Chief of Police; Appointment and Duties; Police Surgeon,86742,52686,62.2,37.8,50%+1,P,Initiative,initiative,Charter Amendment,"The Chief of Police shall be appointed by the Board of Police Commissioners, serve for 4 years and have an annual salary of $6,000. He shall control, manage and direct the department and have the power to suspend temporarily any member of the department. He shall have control of such prisons as are not under the control of the Sheriff. There shall be a Police Surgeon appointed who shall have an annual salary of $1860.",https://sfpl.org/index.php?pg=2000027201&propid=211
11/2/1920,1920,11,2,24,Police Department; Women Protective Officers; Police Matrons,74194,49125,60.1,39.9,50%+1,P,Supervisors,supervisors,Charter Amendment,The Board of Police Commissioners may appoint three women protective officers and four police matrons to receive an annual salary equal to the salary of a police officer and to be subject to the provisions and entitled to the benefits of other department employees.,https://sfpl.org/index.php?pg=2000027201&propid=212
11/2/1920,1920,11,2,25,Teachers in Civil Service; Teachers' Salary Fund; Common School Fund,61975,69806,47.0,53.0,50%+1,F,Supervisors,supervisors,Charter Amendment,"Employees of the School Department including teachers to be part of the Civil Service System. Establishing regulations for disbursement of all moneys belonging to the School Department, the Common School Fund and  the Teachers' Salary Fund. A separate fund shall be designated ""The School Buildings and Grounds Funds"" for school buildings and the land necessary by the levy of a tax of not less than ten cents and not more than fifteen cents of each $100 assessed valuation.",https://sfpl.org/index.php?pg=2000027201&propid=213
11/2/1920,1920,11,2,26,Purchase of Annual Supplies and Contracts for Same,35807,76074,32.0,68.0,50%+1,F,Supervisors,supervisors,Charter Amendment,The Board of Supervisors shall have the power to purchase supplies and award contracts for same for a period of less than one year or it may authorize purchase at one time for a quantity of supplies not to exceed that which is necessary for one year. Every bid for any contract shall be accompanied by an affidavit of the bidder.,https://sfpl.org/index.php?pg=2000027201&propid=214
11/2/1920,1920,11,2,27,Establishment of a City Retirement System,79090,49437,61.5,38.5,50%+1,P,Supervisors,supervisors,Charter Amendment,The Board of Supervisors on the vote of 14 members and with the approval of the Mayor are empowered to establish a retirement system and to provide for death benefits for public employees other than policemen and firemen and elective officers and officers appointed by the Mayor.,https://sfpl.org/index.php?pg=2000027201&propid=215
11/2/1920,1920,11,2,28,Limit on Bonded Indebtedness,55681,66970,45.3,54.7,50%+1,F,Supervisors,supervisors,Charter Amendment,"No indebtedness shall be incurred for the acquisition or construction of any public utility which together with the existing bonded indebtedness shall exceed at any one time 15% (percent) of the assessed value of all real and personal property in the City, with the exception of bonds for the Panama Canal Exposition and any bonded indebtedness already incurred or that may hereafter be incurred for the acquisition and construction of a water supply or water works.",https://sfpl.org/index.php?pg=2000027201&propid=216
11/2/1920,1920,11,2,29,Sale of Bonds for Less Than Par; Limit to Rate of Interest on Future Bonds,74652,45979,61.8,38.2,50%+1,P,Supervisors,supervisors,Charter Amendment,"The Board of Supervisors is hereby authorized to sell certain bonds described as ""School Bonds"" and ""Water Bonds"" below the par or face value, not to be less than that which will net the purchaser 5 1/2% (percent) according to the standard table of bond values. The interest on bonds hereafter may be fixed at any rate not in excess of 5 1/2% per year.",https://sfpl.org/index.php?pg=2000027201&propid=217
11/2/1920,1920,11,2,30,Acquisition of Public Utilities,75853,49531,60.4,39.6,50%+1,P,Supervisors,supervisors,Charter Amendment,The mode and procedure for the acquisition of any utility in whole or in part shall not be deemed exclusive. The Board of Supervisors by not less than a two-thirds vote may adopt an ordinance providing for the mode and procedure for acquisition by purchase of any public utility in whole or in part. Said ordinance must be approved by a majority of the electors and such acquisition by bonded indebtedness must be approved by a two-thirds vote of the electors.,https://sfpl.org/index.php?pg=2000027201&propid=218
11/2/1920,1920,11,2,31,Signature of City Officials to be Valid Until Delivery of Bonds,78561,32731,70.5,29.5,50%+1,P,Supervisors,supervisors,Charter Amendment,"In case any of the officers whose signatures appear on the bonds shall cease to be such officers before the delivery of such bonds to the purchaser, such signatures shall nevertheless be valid for all purposes, the same as if they had remained in office until the delivery of the bonds.",https://sfpl.org/index.php?pg=2000027201&propid=219
11/2/1920,1920,11,2,32,"Control of the Wharves, Waterfront and Harbor",71033,48854,59.2,40.8,50%+1,P,Supervisors,supervisors,Charter Amendment,"The Board of Supervisors of the Board of Public Works shall continue their control and management of the wharves, waterfront and harbor of San Francisco until such time as the lands situated on the City side of the Bay transfer from the jurisdiction of the Board of State Harbor Commissioners to the jurisdiction of the Board of Supervisors or the Board of Public Works. Thereafter, the Board of Supervisors or the Board of Public Works will have the authority to govern, administer and control such lands and to improve and develop navigation, commerce and fishing thereon and thereover.",https://sfpl.org/index.php?pg=2000027201&propid=220
11/2/1920,1920,11,2,33,Sealer of Weights and Measures,48824,74017,39.7,60.3,50%+1,F,Supervisors,supervisors,Charter Amendment,Any person who has served as Sealer of Weights and Measures or any other employee of the Weights and Measures Department who has served for a continuous period of six months is considered to be appointed to the position and entitled to all benefits of the position.,https://sfpl.org/index.php?pg=2000027201&propid=221
11/2/1920,1920,11,2,34,Charter Positions Abolished and Created; Civil Service Exempt,46815,72272,39.3,60.7,50%+1,F,Supervisors,supervisors,Charter Amendment,Various Charter positions are abolished and created. Holders of the new positions are declared to be appointed and exempt from Civil Service examination.,https://sfpl.org/index.php?pg=2000027201&propid=222
11/2/1920,1920,11,2,35,Compensation of Interpreters Appointed by Judges of the Superior Court,46987,75452,38.3,61.7,50%+1,F,Supervisors,supervisors,Charter Amendment,"To provide for the compensation, not to exceed $150 monthly, to interpreters appointed by the Judges of Superior Court to interpret testimony in criminal cases in said Court or in Police Court or upon inquests and examinations.",https://sfpl.org/index.php?pg=2000027201&propid=223
11/2/1920,1920,11,2,36,Temporary or Permanent Civil Service Positions,51617,65542,44.0,56.0,50%+1,F,Supervisors,supervisors,Charter Amendment,"For the purpose of retaining experienced and trained workers nothing shall prevent the selection for temporary or permanent employment, of all persons employed since January 1, 1915, as seasonal or temporary Civil Service employees, whose cumulative term of service aggregates to a period of one year at the time of adoption of this amendment.",https://sfpl.org/index.php?pg=2000027201&propid=224
11/2/1920,1920,11,2,37,Election of Board of Education Members Appointed by the Mayor,69203,66660,50.9,49.1,50%+1,P,Supervisors,supervisors,Charter Amendment,"Appointments to the Board of Education shall be made by the Mayor, subject to confirmation by the electors. The Mayor shall file the names of qualified citizens to serve as members of the Board of Education with the Registrar of Voters between September 1 and 10 of each year. At the general election the following November, names so filed will appear on the ballot.",https://sfpl.org/index.php?pg=2000027201&propid=225
11/2/1920,1920,11,2,38,Veterans' Preference in Civil Service Appointments,84632,38617,68.6,31.4,50%+1,P,Supervisors,supervisors,Charter Amendment,The Civil Service Commission shall by rule establish preference for veterans both within the Police and Fire Departments and for all other entrance examinations other than for positions within the Police and Fire Department.,https://sfpl.org/index.php?pg=2000027201&propid=226
11/2/1920,1920,11,2,39,Tax for Park Purposes,84848,41126,67.3,32.7,50%+1,P,Supervisors,supervisors,Charter Amendment,"The Board of Supervisors shall provide all necessary money for the maintenance, preservation and improvement of all parks, squares, avenues and grounds and to that end shall levy an annual tax which shall be not less than seven cents and not more than ten cents for each $100 assessed valuation.",https://sfpl.org/index.php?pg=2000027201&propid=227
11/2/1920,1920,11,2,40,Tax for Library and Reading Room Purposes,78441,42897,64.6,35.4,50%+1,P,Supervisors,supervisors,Charter Amendment,"The Board of Supervisors shall for the purpose of maintaining such library and reading rooms and such branches as the Board of Library Trustees may from time to time establish, and for the purchase of books and  journals and for the purchase of or leasing of real and personal property for construction of necessary buildings, levy an annual tax which shall not be less than 2 1/2 cents and not more than 3 3/4 cents on each $100 assessed valuation. The revenue of such tax shall be credited to the Library Fund.",https://sfpl.org/index.php?pg=2000027201&propid=228
11/2/1920,1920,11,2,41,"Pensions of Firemen who Retired Prior to January 1, 1900",84,42508,66.6,33.4,50%+1,P,Supervisors,supervisors,Charter Amendment,"All firemen who were retired under the provisions of the law prior to January 1, 1900, shall be entitled to receive from the Firemen's Retirement Fund the sum of $75 per month from and after July 1, 1921.",https://sfpl.org/index.php?pg=2000027201&propid=229
11/2/1920,1920,11,2,42,Street Work and Contracts for Same,42661,73526,36.7,63.3,50%+1,F,Supervisors,supervisors,Charter Amendment,The Board of Supervisors is empowered by ordinance to provide for bids for street work and may supply any contractor with any or all the work necessary.,https://sfpl.org/index.php?pg=2000027201&propid=230
11/2/1920,1920,11,2,43,Extension of Masonic Avenue Across the Panhandle of Golden Gate Park,85145,38205,69.0,31.0,50%+1,P,Supervisors,supervisors,Charter Amendment,"A public street is hereby opened up and dedicated to public use across the ""Panhandle"" of Golden Gate Park as a continuation and extension of Masonic Avenue.",https://sfpl.org/index.php?pg=2000027201&propid=231
11/2/1920,1920,11,2,44,"Police Photographer, Appointment and Salary",62494,61369,50.4,49.6,50%+1,P,Supervisors,supervisors,Charter Amendment,The Board of Police Commissioners may appoint one Police Photographer to receive an annual salary of not less than $2400. Position shall not be entitled to accrue any pension unless the person in the position is an actual member of the Police Force.,https://sfpl.org/index.php?pg=2000027201&propid=232
11/2/1920,1920,11,2,45,License Taxes for Regulation and Revenue,56971,58318,49.4,50.6,50%+1,F,Supervisors,supervisors,Charter Amendment,"License taxes shall be imposed for the purpose of regulation and revenue generation. License taxes levied on any person, firm or corporation selling or manufacturing any goods at a fixed place of business shall not exceed 1/10 of one percent of the annual sales.",https://sfpl.org/index.php?pg=2000027201&propid=233
11/2/1920,1920,11,2,46,"Police Court Judges, Terms and Salaries",23516,101148,18.8,81.2,50%+1,F,Supervisors,supervisors,Charter Amendment,"There shall be four Police Judges who shall be elected by the people  to serve a term of six years and to receive an annual salary of $6,000. Police Court shall be divided into four departments.",https://sfpl.org/index.php?pg=2000027201&propid=234
11/2/1920,1920,11,2,47,Salaries of Elected Officials,28960,94541,23.4,76.6,50%+1,F,Supervisors,supervisors,Charter Amendment,"As of July 1, 1921 the following officers of the City shall have their annual salaries fixed at $6,000: District Attorney, Auditor, County Clerk, Treasurer, Coroner, Recorder, Tax Collector and City Attorney. Each member of the Board of Supervisors shall receive an annual salary of $3,600 and each member of the Board of Election Commissioners shall receive an annual salary of $1,500.",https://sfpl.org/index.php?pg=2000027201&propid=235
11/2/1920,1920,11,2,48,Salaries of Officers and Members of Fire Department and Duties of Select Officers,105573,40526,72.2,27.8,50%+1,P,Initiative,initiative,Charter Amendment,"The various officers and members of the Fire Department shall have fixed salaries. The Chief Engineer may assign duties as Chief Operator to members of the Department as he sees fit, not to exceed two for the Chief Engineer and one for each Assistant Chief and Battalion Chief.",https://sfpl.org/index.php?pg=2000027201&propid=236
11/7/1922,1922,11,7,31,Light Wines and Beer,77282,32807,70.1,29.9,50%+1,P,Supervisors,supervisors,Policy Declaration,Shall Congress be memorialized to so amend the law of as to permit the manufacture and use of light wines and beer for beverage purposes?,https://sfpl.org/index.php?pg=2000027201&propid=237
11/7/1922,1922,11,7,32,Disciplinary Suspensions; Civil Service Training Courses; Salary Standardization,20943,90303,18.8,81.2,50%+1,F,Initiative,initiative,Charter Amendment,"To provide efficiency of departments and opportunities for advancement, the following amendments shall be added to the Charter: An employee may be suspended for a period not to exceed 30 days for cause; the Civil Service Commission shall establish training courses for persons on eligible lists; department heads shall prepare records of service and the Civil Service Commission shall add such records to it annual report; the Board of Supervisors shall appropriate an amount of the annual aggregate payroll to be used for the purpose of salary standardization.",https://sfpl.org/index.php?pg=2000027201&propid=238
11/7/1922,1922,11,7,33,Assistant Deputy Coroner,47945,53886,47.0,53.0,50%+1,F,Supervisors,supervisors,Charter Amendment,The Assistant Deputy Coroner after having served for a one year continuous period in the position is declared to be appointed to the position and entitled to all benefits of the position.,https://sfpl.org/index.php?pg=2000027201&propid=239
11/7/1922,1922,11,7,34,"Chief Bookkeeper, Cashier, Office of the Sheriff",49549,53188,48.2,51.8,50%+1,F,Supervisors,supervisors,Charter Amendment,Any person who has served for a period of five years continuously in the positions of Chief Bookkeeper and Cashier in the Office of the Sheriff shall be considered appointed to the positions and entitled to all benefits of the positions.,https://sfpl.org/index.php?pg=2000027201&propid=240
11/7/1922,1922,11,7,35,Meetings of Boards and Commissions Open to the Public,74611,24497,75.2,24.8,50%+1,P,Supervisors,supervisors,Charter Amendment,"All meetings, regular or special, of every board or commission shall be open to the public except special meetings held by the Civil Service Commission for approving payrolls and adopting examination questions.",https://sfpl.org/index.php?pg=2000027201&propid=241
11/7/1922,1922,11,7,36,Police Department Detectives,62659,40500,60.7,39.3,50%+1,P,Supervisors,supervisors,Charter Amendment,Relating to the salaries and rank of Police Department Detectives.,https://sfpl.org/index.php?pg=2000027201&propid=242
11/7/1922,1922,11,7,37,Pensions of Policemen and Firemen,51527,42777,54.6,45.4,50%+1,P,Supervisors,supervisors,Charter Amendment,The Board of Police Commissioners and the Board of Fire Pension Fund Commissions shall have the final decision in determining pensions for the Police Department and the Fire Department employees.,https://sfpl.org/index.php?pg=2000027201&propid=243
11/7/1922,1922,11,7,38,Voter Registration; Registrar of Voters Compensation,59092,38055,60.8,39.2,50%+1,P,Supervisors,supervisors,Charter Amendment,The Board of Election Commissioners may fix the compensation of deputies employed to provide for voter registration of the eligible voters of the City.,https://sfpl.org/index.php?pg=2000027201&propid=244
